{
  "capture": {
    "height": 600,
    "path": "foot-tmux.png",
    "sha256": "a58f1d58ff82007665fd1023c13703e2c46c46c17336f5e73ea644877ec7d4a7",
    "width": 960
  },
  "cleanup": {
    "ambient_counts_unchanged": true,
    "clients_absent": true,
    "failure": null,
    "namespace_absent": true,
    "process_forest_absent": true,
    "server_absent": true,
    "verified": true,
    "window_absent": true,
    "workloads_absent": true
  },
  "failure": null,
  "geometry": {
    "after_graphical_attach": [
      {
        "columns": 58,
        "name": "pane-0",
        "rows": 28,
        "runtime_id": "%0",
        "x": 0,
        "y": 0
      },
      {
        "columns": 58,
        "name": "pane-1",
        "rows": 28,
        "runtime_id": "%1",
        "x": 59,
        "y": 0
      }
    ],
    "before_graphical_attach": [
      {
        "columns": 59,
        "name": "pane-0",
        "rows": 40,
        "runtime_id": "%0",
        "x": 0,
        "y": 0
      },
      {
        "columns": 60,
        "name": "pane-1",
        "rows": 40,
        "runtime_id": "%1",
        "x": 60,
        "y": 0
      }
    ],
    "stable_seconds": 0.3
  },
  "implementation": "tmux",
  "isolation": {
    "ambient_after": {
      "default_session_count": 0,
      "process_count": 0
    },
    "ambient_before": {
      "default_session_count": 0,
      "process_count": 0
    },
    "ambient_names_recorded": false,
    "host_state_before": {
      "cursor": {
        "x": 1682,
        "y": 932
      },
      "focus_address": "0x55d06bc2fe70",
      "workspace": {
        "id": 1,
        "monitor": "DP-1"
      }
    },
    "host_state_preserved": true,
    "monitor": "DP-2",
    "no_initial_focus": true,
    "run_id": "gsmoke-1-foot-tmux",
    "workspace": 8
  },
  "notes": [
    "Guarded development smoke only; readiness values are not a performance ranking.",
    "The terminal was mapped silently on inactive workspace 8 / DP-2."
  ],
  "process_roles": {
    "role_sets_disjoint": true,
    "roles": [
      {
        "processes": [
          {
            "pid": 314204,
            "start_ticks": 244261
          }
        ],
        "role": "server"
      },
      {
        "processes": [
          {
            "pid": 314214,
            "start_ticks": 244268
          }
        ],
        "role": "terminal-host"
      },
      {
        "processes": [
          {
            "pid": 314221,
            "start_ticks": 244270
          }
        ],
        "role": "multiplexer-client"
      },
      {
        "processes": [],
        "role": "helper"
      },
      {
        "processes": [
          {
            "pid": 314205,
            "start_ticks": 244261
          },
          {
            "pid": 314208,
            "start_ticks": 244261
          }
        ],
        "role": "workload"
      }
    ]
  },
  "readiness": {
    "pane-0": {
      "event": "ready",
      "monotonic_ns": 2442668652621,
      "pid": 314205,
      "schema": "splinterm.benchmark.child.v1"
    },
    "pane-1": {
      "event": "ready",
      "monotonic_ns": 2442669868225,
      "pid": 314208,
      "schema": "splinterm.benchmark.child.v1"
    }
  },
  "runtime_ids": {
    "pane-0": "%0",
    "pane-1": "%1"
  },
  "schema": "splinterm.benchmark.multiplexer-graphical-smoke.v1",
  "stack": "foot-tmux",
  "topology": {
    "name": "two-columns",
    "pane_count": 2,
    "panes": [
      "pane-0",
      "pane-1"
    ]
  },
  "valid": true
}
